{
  "$schema": "../../estudio/esquemas/dialogos.schema.json",
  "version": 1,
  "temas": {
    "venjy": [
      {
        "id": "quien",
        "p": { "es": "¿Quién eres?", "en": "Who are you?" },
        "r": {
          "es": "Soy Venjy, o Benjamín. Estudio Ingeniería en Informática y armé este mundo bloque por bloque.",
          "en": "I'm Venjy, or Benjamín. I study Computer Engineering and built this world block by block."
        },
        "g": "yo",
        "skin": {
          "pony": {
            "es": "¿Cómo que quién soy, Pony? Agáchate un poco para verme... ah, no, si ya estás abajo.",
            "en": "What do you mean who am I, Pony? Crouch a little to see me... oh wait, you are already down there."
          },
          "boris": {
            "es": "¿Tú preguntándome quién soy? Si eres el que me va a buscar en auto a Linares.",
            "en": "You're asking who I am? You're the one who picks me up by car in Linares."
          },
          "moises": {
            "es": "Moisés, nos conocemos desde Coyhaique, cuando teníamos trece. No me vengas con esa.",
            "en": "Moisés, we've known each other since Coyhaique, when we were thirteen. Don't give me that."
          },
          "lalo": {
            "es": "¿Lalo? ¿En serio? Desde los trece en Coyhaique y ahora me preguntas quién soy.",
            "en": "Lalo? Seriously? Since we were thirteen in Coyhaique and now you ask who I am."
          },
          "salonas": {
            "es": "Socio, soy el otro que se desvela con ProcedimientoSeguro. El del café.",
            "en": "Partner, I'm the other one losing sleep over ProcedimientoSeguro. The coffee guy."
          },
          "lona": {
            "es": "Soy tu pololo, Lona. El que le abre la puerta a las gatas a las cuatro de la mañana.",
            "en": "I'm your boyfriend, Lona. The one who opens the door for the cats at four in the morning."
          },
          "braulio": {
            "es": "Braulio, soy Venjy. El que siempre te pide que muestres el dedo doble.",
            "en": "Braulio, I'm Venjy. The one who always asks you to show the double finger."
          },
          "lucho": {
            "es": "Primo, soy tu primo. Bueno, el hijo de tu prima. Da lo mismo, jugamos Apex igual.",
            "en": "Cousin, I'm your cousin. Well, your cousin's son. Doesn't matter, we play Apex anyway."
          }
        }
      },
      {
        "id": "aqui",
        "p": { "es": "¿Qué haces aquí?", "en": "What are you doing here?" },
        "r": {
          "es": "Cuido el Inicio y reparto las peleas de jefe. Alguien tiene que hacer de anfitrión.",
          "en": "I look after the Start and hand out the boss fights. Somebody has to be the host."
        }
      },
      {
        "id": "mundo",
        "p": { "es": "¿Qué es este lugar?", "en": "What is this place?" },
        "r": {
          "es": "Es mi portafolio, pero en bloques. Cada zona es algo que hice o alguien que quiero.",
          "en": "It's my portfolio, but in blocks. Every zone is something I made or someone I love."
        },
        "g": "tu"
      },
      {
        "id": "opina",
        "p": { "es": "¿Qué opinas de...?", "en": "What do you think of...?" },
        "req": { "nivel": 1 }
      },
      {
        "id": "proyectos",
        "p": { "es": "¿Qué estás construyendo ahora?", "en": "What are you building now?" },
        "r": {
          "es": "Ahora mismo, este juego. Antes, ProcedimientoSeguro con Salonas. Mañana, quién sabe.",
          "en": "Right now, this game. Before that, ProcedimientoSeguro with Salonas. Tomorrow, who knows."
        },
        "req": { "nivel": 2 },
        "g": "rasca"
      },
      {
        "id": "imbunche",
        "p": { "es": "¿Cómo inventaste al Imbunche?", "en": "How did you come up with the Imbunche?" },
        "r": {
          "es": "Lo dibujé en papel antes de programarlo. En papel daba menos miedo, te lo juro.",
          "en": "I drew it on paper before coding it. On paper it was less scary, I swear."
        },
        "req": { "jefe": "jefe1" },
        "g": "risa"
      },
      {
        "id": "caleuche",
        "p": { "es": "¿Y ahora qué hacemos?", "en": "So what do we do now?" },
        "r": {
          "es": "Ahora nada: lo salvaste todo. Pásate a la fogata, que allá celebran mejor que yo.",
          "en": "Now nothing: you saved it all. Go by the campfire, they celebrate better than I do."
        },
        "req": { "jefe": "jefe3" },
        "g": "brazosArriba"
      },
      {
        "id": "secreto",
        "p": { "es": "Cuéntame algo que nadie sepa", "en": "Tell me something nobody knows" },
        "r": {
          "es": "Hay un bloque en este mapa que puse solo porque me gustó el color. No te voy a decir cuál.",
          "en": "There's a block in this map I placed only because I liked the color. I won't tell you which one."
        },
        "req": { "nivel": 3 },
        "g": "rasca"
      }
    ],
    "pony": [
      {
        "id": "quien",
        "p": { "es": "¿Quién eres?", "en": "Who are you?" },
        "r": {
          "es": "Soy el Pony. Pescador de muelle y, según todos, el más chico del grupo. Mentira, el Braulio es más chico.",
          "en": "I'm Pony. Dock fisherman and, according to everyone, the shortest of the group. Lies, Braulio is shorter."
        },
        "g": "yo",
        "skin": {
          "salonas": {
            "es": "¿Me estás preguntando quién soy, waton klo? Anda a tocar tu bajo.",
            "en": "Are you asking who I am, you big goof? Go play your bass."
          },
          "hadad": {
            "es": "Hadad, si vienes a venderme papas fritas de bolsa como en tu comercial, me tiro al mar.",
            "en": "Hadad, if you came to sell me bagged potato chips like in your ad, I'm jumping into the sea."
          },
          "andy": {
            "es": "Andy, soy yo, tu ex compañero de trabajos. Ya sé, ya sé, te webiaba demasiado.",
            "en": "Andy, it's me, your old project partner. I know, I know, I goofed around too much."
          },
          "nacho": {
            "es": "Nacho, me conoces de sobra. Ríete primero y después pregunto yo.",
            "en": "Nacho, you know me well enough. Laugh first and then I ask."
          },
          "braulio": {
            "es": "Braulio, antes de preguntar ponte espalda con espalda conmigo. A ver quién es más chico.",
            "en": "Braulio, before asking, stand back to back with me. Let's see who's shorter."
          },
          "conejeros": {
            "es": "Mira quién llegó, mi enemigo favorito. Ya sabes quién soy, no te hagai.",
            "en": "Look who showed up, my favorite enemy. You know who I am, don't play dumb."
          }
        }
      },
      {
        "id": "aqui",
        "p": { "es": "¿Qué haces aquí?", "en": "What are you doing here?" },
        "r": {
          "es": "Pesco. Bueno, espero que piquen, que es casi lo mismo pero con más paciencia.",
          "en": "I fish. Well, I wait for bites, which is almost the same but with more patience."
        }
      },
      {
        "id": "venjy",
        "p": { "es": "¿Cómo conociste a Venjy?", "en": "How did you meet Venjy?" },
        "r": {
          "es": "En la U, estudiando Informática. Somos del grupo Tomatitos, y desde el primer día Venjy me dice que soy chico.",
          "en": "At uni, studying Computer Engineering. We're in the Tomatitos group, and since day one Venjy has called me short."
        },
        "g": "rasca",
        "skin": {
          "venjy": {
            "es": "¿Me preguntai cómo te conocí? En la U, y al toque me dijiste chico. Tomatitos hasta el final.",
            "en": "You're asking how I met you? At uni, and right away you called me short. Tomatitos till the end."
          }
        }
      },
      {
        "id": "opina",
        "p": { "es": "¿Qué opinas de...?", "en": "What do you think of...?" },
        "req": { "nivel": 1 }
      },
      {
        "id": "abuelo",
        "p": { "es": "¿Quién te enseñó a pescar?", "en": "Who taught you to fish?" },
        "r": {
          "es": "Mi abuelo de Tomé, el de los bacalaos. Me dijo que el mar no se apura y que yo tampoco.",
          "en": "My grandpa from Tomé, the cod one. He told me the sea is never in a hurry and neither should I be."
        },
        "req": { "nivel": 2 }
      },
      {
        "id": "karly",
        "p": { "es": "¿Y la Profe Karly?", "en": "And Teacher Karly?" },
        "r": {
          "es": "Ya te conté su historia completa, ¿qué más quieres? La próxima vez que pesquemos te cuento otra.",
          "en": "I already told you her whole story, what else do you want? Next time we fish I will tell you another."
        },
        "req": { "mj": "pesca" },
        "g": "risa"
      },
      {
        "id": "caleuche",
        "p": { "es": "¿Viste caer el Caleuche?", "en": "Did you see the Caleuche go down?" },
        "r": {
          "es": "Lo vi hundirse desde el muelle. Te juro que un pez saltó a aplaudir.",
          "en": "I watched it sink from the dock. I swear a fish jumped out to applaud."
        },
        "req": { "jefe": "jefe3" },
        "g": "sorpresa"
      },
      {
        "id": "secreto",
        "p": { "es": "Cuéntame algo que nadie sepa", "en": "Tell me something nobody knows" },
        "r": {
          "es": "A veces no le pongo carnada al anzuelo. Me gusta sentarme acá aunque no pique nada.",
          "en": "Sometimes I don't bait the hook. I just like sitting here even if nothing bites."
        },
        "req": { "nivel": 3 }
      }
    ],
    "salonas": [
      {
        "id": "quien",
        "p": { "es": "¿Quién eres?", "en": "Who are you?" },
        "r": {
          "es": "Salonas, bajista de cinco cuerdas. Si suena raro, es a propósito.",
          "en": "Salonas, five-string bassist. If it sounds weird, it's on purpose."
        },
        "g": "cabecea",
        "skin": {
          "pony": {